id,platform,post_date,post_time,content,image_url,link_url,hashtags,status,posted_at,post_id,notes
1,linkedin,2026-02-10,08:30,"Epyc Courier Service is Los Angeles' HIPAA-compliant medical courier partner. We serve hospitals, clinical laboratories, pharmacies, urgent care facilities, and physician offices across LA County. Our team maintains strict chain of custody protocols, temperature-controlled transport, and real-time tracking on every delivery. When specimen integrity matters, Epyc delivers. 98.7% on-time. Every time.",,https://www.epyccs.com,"#HealthcareLogistics #HIPAA #MedicalCourier #LosAngelesHealthcare #LabLogistics #SpecimenTransport",pending,,,Medical Focus - Launch Week
2,instagram,2026-02-10,11:00,"Your specimens deserve better than a generic delivery service. HIPAA-compliant. Temperature-controlled. Chain of custody documented. 98.7% on-time. Serving LA County hospitals, labs, and pharmacies. Epyc Courier Service — Precision Delivery. Every Time. 818-217-0070",https://epyccs.com/images/medical-courier.jpg,,"#MedicalCourier #HIPAA #LosAngeles #LabLogistics #HealthcareLogistics #SpecimenTransport #CourierService #LABusiness #SmallBusinessLA #SameDayDelivery",pending,,,Medical Instagram Launch
3,facebook,2026-02-10,13:00,"Los Angeles healthcare providers: tired of unreliable courier services putting your specimens and patient care at risk? Epyc Courier Service provides HIPAA-compliant medical delivery throughout LA County. Chain of custody. Temperature control. Real-time tracking. 98.7% on-time rate. Call us: 818-217-0070 | www.epyccs.com",,https://www.epyccs.com/contact,"#LosAngeles #HealthcareLogistics #MedicalCourier #SupportLocal #LABusiness",pending,,,Medical Facebook Launch
4,linkedin,2026-02-12,08:30,"The hidden cost of unreliable medical deliveries: A single compromised specimen means: → Patient callback and recollection → Delayed diagnosis and treatment → Staff time managing exceptions → Regulatory exposure from broken chain of custody → Damaged provider relationships. At Epyc Courier Service, we eliminate these risks with HIPAA-compliant protocols, temperature monitoring, and documented chain of custody on every pickup. Los Angeles labs and pharmacies trust us because our 98.7% on-time rate is not a marketing claim — it is an operational standard.",,https://www.epyccs.com/contact,"#MedicalCourier #HealthcareLogistics #HIPAA #LabManagement #LosAngeles #SpecimenIntegrity",pending,,,Medical Pain Point
5,instagram,2026-02-12,11:00,"5 things your medical courier should guarantee: 1. HIPAA training for every driver — annually 2. Chain of custody documentation on every delivery 3. Temperature-controlled transport options 4. Real-time GPS tracking you can see 5. Same-day and STAT delivery capability. If your current courier can not check all five boxes, it is time to talk to Epyc. 818-217-0070",https://epyccs.com/images/lab-specimen.jpg,,"#MedicalCourier #HIPAA #LosAngeles #LabLogistics #HealthcareDelivery #CourierService #LABusiness #PharmacyDelivery #SpecimenTransport #SameDayDelivery",pending,,,Medical Checklist
6,facebook,2026-02-12,13:00,"Not all courier services understand healthcare compliance. At Epyc, every delivery follows HIPAA Privacy Rule (45 CFR Part 164) requirements. Our drivers complete annual HIPAA training. Your specimens are handled with documented chain of custody from the moment we pick up to the moment we deliver. That is the Epyc standard. Learn more: www.epyccs.com | 818-217-0070",,https://www.epyccs.com,"#HIPAA #MedicalCourier #LosAngeles #LABusiness #HealthcareCompliance",pending,,,HIPAA Compliance
7,linkedin,2026-02-14,12:00,"Same-day delivery is not about speed. It is about precision. When a law firm needs a court filing delivered before 4:00 PM, when a lab needs a specimen at the reference lab within 2 hours, when a pharmacy needs medication at a patient's home before end of day — precision is what matters. Epyc Courier Service provides 2-hour, 4-hour, and same-day delivery across the Los Angeles metropolitan area. Real-time tracking. Signature verification. Proof of delivery. Your deadline is our mission.",,https://www.epyccs.com/contact,"#SameDayDelivery #LosAngelesLogistics #CourierServices #B2BLogistics #LegalCourier #RushDelivery",pending,,,Same-Day Precision
8,instagram,2026-02-14,11:00,"When tomorrow is not good enough: 2-hour delivery. 4-hour delivery. Same-day guaranteed. Legal documents. Medical specimens. Critical parts. Pharmaceuticals. We know LA traffic. We know the buildings. We know the shortcuts. Your package. Our priority. Epyc Courier Service. 818-217-0070",https://epyccs.com/images/on-demand.jpg,,"#SameDayDelivery #RushDelivery #LosAngelesCourier #TimeMatters #LALogistics #CourierService #LegalCourier #MedicalCourier #SmallBusinessLA #DTLA",pending,,,Same-Day Rush
9,linkedin,2026-02-17,08:30,"For clinical laboratories processing hundreds of specimens daily, courier reliability is not a convenience — it is a clinical requirement. One late pickup can cascade into: delayed test results, compromised specimen viability, patient treatment delays, and regulatory documentation gaps. Epyc Courier Service provides dedicated medical routes designed around YOUR clinical schedule, not generic delivery windows. We currently serve independent labs, reference laboratories, and hospital outreach labs throughout Los Angeles County. If specimen integrity is non-negotiable for your lab, we should talk.",,https://www.epyccs.com/contact,"#ClinicalLaboratory #MedicalCourier #LabLogistics #SpecimenTransport #HIPAA #LosAngeles #HealthcareOperations",pending,,,Lab-Specific Outreach
10,instagram,2026-02-17,11:00,"Behind every Epyc delivery: Real drivers. Real tracking. Real accountability. Your deliveries are handled by our team — never subcontracted to random gig workers. When you call Epyc, you get Epyc. That is the difference. Serving all of Los Angeles County. 818-217-0070 | www.epyccs.com",https://epyccs.com/images/package-delivery.jpg,,"#CourierLife #LADelivery #SmallBusinessLA #ReliableDelivery #BehindTheScenes #LosAngeles #CourierService #TrustMatters #LocalBusiness #B2B",pending,,,Trust/Brand
11,facebook,2026-02-17,13:00,"Los Angeles law firms: How much does a missed court filing deadline cost your practice? At Epyc Courier Service, we handle same-day document delivery, court filings, and confidential legal packages across LA County. Real-time tracking. Signature verification. Proof of delivery on every pickup. Your deadlines are our mission. 818-217-0070 | rico@epyccs.com | www.epyccs.com",,https://www.epyccs.com/contact,"#LegalCourier #LawFirm #LosAngeles #CourtFiling #SameDayDelivery #LABusiness",pending,,,Legal Vertical
12,linkedin,2026-02-19,08:30,"Specialty pharmacies have unique courier requirements that generic delivery services cannot meet: → Temperature-controlled transport for biologics and compounded medications → STAT delivery for hospice and urgent patient needs → Chain of custody for controlled substances → HIPAA-compliant handling of patient information → Scheduled daily routes that match dispensing schedules. Epyc Courier Service works with compounding pharmacies, LTC pharmacies, infusion pharmacies, and specialty pharmacies throughout Los Angeles. We built our medical courier program specifically for these demands.",,https://www.epyccs.com/contact,"#SpecialtyPharmacy #CompoundingPharmacy #PharmacyDelivery #HIPAA #MedicalCourier #LosAngeles #HealthcareLogistics",pending,,,Pharmacy Vertical
13,instagram,2026-02-19,11:00,"Your pharmacy's reputation rides on every delivery. Late medication. Wrong temperature. No documentation. These are not just logistics failures — they are patient care failures. Epyc Courier Service: HIPAA-compliant pharmacy delivery with temperature control and chain of custody. Serving LA County pharmacies daily. 818-217-0070",https://epyccs.com/images/pharmaceutical.jpg,,"#PharmacyDelivery #CompoundingPharmacy #HIPAA #MedicalCourier #LosAngeles #HealthcareLogistics #CourierService #PatientCare #SpecialtyPharmacy #LABusiness",pending,,,Pharmacy Instagram
14,facebook,2026-02-19,13:00,"What sets Epyc Courier Service apart from other LA couriers? 1. Locally owned and operated — deep LA logistics knowledge 2. HIPAA-compliant — annual training, chain of custody, PHI protection 3. Never subcontracted — your packages stay in our hands 4. Real-time tracking on every single delivery 5. 98.7% on-time delivery rate 6. 24/7 dispatch availability. We are not trying to be everything to everyone. We are building the most reliable courier service in Los Angeles. 818-217-0070 | www.epyccs.com",,https://www.epyccs.com,"#CourierService #LosAngeles #LABusiness #SmallBusinessLA #ReliableDelivery #SupportLocal",pending,,,Differentiator Post
15,linkedin,2026-02-21,12:00,"B2B logistics should be predictable, not stressful. If your business relies on daily deliveries — documents between offices, parts to job sites, samples to labs — you need a courier partner, not a different app every day. Epyc Courier Service provides: • Dedicated scheduled routes with guaranteed windows • Volume-based pricing that scales with your business • SLA-backed performance guarantees • Monthly reporting and analytics • One dedicated account contact. We become an extension of your operations team. Serving businesses across the entire Los Angeles metropolitan area.",,https://www.epyccs.com/contact,"#B2BLogistics #BusinessLogistics #ScheduledRoutes #LosAngeles #SupplyChain #OperationsManagement #CourierServices",pending,,,B2B Value Prop
16,instagram,2026-02-21,11:00,"Scheduled routes. Guaranteed windows. One point of contact. That is what B2B logistics should look like. Epyc Courier Service partners with businesses across LA for dedicated delivery routes, volume pricing, and SLA-backed performance. Your team focuses on what they do best. We handle the logistics. 818-217-0070",https://epyccs.com/images/scheduled-route.jpg,,"#B2BLogistics #BusinessLogistics #LosAngeles #ScheduledDelivery #CourierService #LABusiness #SmallBusinessLA #OperationsManagement #Logistics #SupplyChain",pending,,,B2B Instagram
17,linkedin,2026-02-24,08:30,"The Los Angeles medical courier market demands a higher standard. With over 1200 CLIA-certified laboratories, 350+ specialty pharmacies, and 100+ hospitals in LA County alone, healthcare facilities need courier partners who understand clinical operations — not just delivery logistics. Epyc Courier Service was built for this market. HIPAA compliance is not an add-on. Chain of custody is not optional. Temperature monitoring is standard. If your facility is still using a general courier service for medical deliveries, the risk outweighs the savings.",,https://www.epyccs.com/contact,"#MedicalCourier #HIPAA #LosAngeles #HealthcareLogistics #ClinicalLaboratory #LabLogistics #SpecimenTransport",pending,,,Market Authority
18,instagram,2026-02-24,11:00,"From Downtown LA to the Valley. From the Westside to the South Bay. From Pasadena to Long Beach. Every corner of Los Angeles County. One courier service. One standard. 98.7% on-time. Epyc Courier Service. 818-217-0070 | www.epyccs.com",https://epyccs.com/images/commercial-delivery.jpg,,"#LosAngeles #DTLA #SFV #WestsideLA #SouthBay #Pasadena #LongBeach #CourierService #SameDayDelivery #LABusiness #SmallBusinessLA #Delivery",pending,,,Coverage Map
19,facebook,2026-02-24,13:00,"Calling all LA compounding pharmacies, LTC pharmacies, and specialty pharmacies: Your patients are waiting. Your medications are time-sensitive. Your compliance requirements are strict. Epyc Courier Service provides daily dedicated pharmacy routes with: Temperature-controlled transport. Chain of custody documentation. HIPAA-compliant handling. STAT delivery for urgent patient needs. Let us handle the delivery so you can focus on the patient. 818-217-0070 | rico@epyccs.com",,https://www.epyccs.com/contact,"#CompoundingPharmacy #LTCPharmacy #SpecialtyPharmacy #HIPAA #LosAngeles #PharmacyDelivery #MedicalCourier",pending,,,Pharmacy CTA
20,linkedin,2026-02-26,08:30,"Dental laboratories in Los Angeles: How are you currently transporting impressions, crowns, and prosthetics between your lab and dental offices? Every day of transit delay is a day your dentist client waits — and a day their patient waits. Epyc Courier Service provides same-day pickup and delivery for dental labs throughout LA County. Careful handling. Proof of delivery. Dedicated routes available for high-volume labs. Fast turnaround on your work deserves fast turnaround on delivery.",,https://www.epyccs.com/contact,"#DentalLab #DentalLogistics #LosAngeles #CourierService #DentalIndustry #SameDayDelivery #B2BLogistics",pending,,,Dental Lab Vertical
21,instagram,2026-02-26,11:00,"Every business in LA has a delivery problem. Some know it. Some are still paying for it. Missed deadlines. Lost packages. No tracking. No accountability. Epyc Courier Service exists to solve that problem. One call. One partner. Every delivery tracked. 818-217-0070",https://epyccs.com/images/inter-office.jpg,,"#CourierService #LosAngeles #BusinessSolutions #SameDayDelivery #B2BLogistics #LABusiness #SmallBusinessLA #ReliableDelivery #Logistics #DeliveryService",pending,,,Pain Point General
22,facebook,2026-02-26,13:00,"Home health agencies across LA: Do you need reliable same-day delivery of medical supplies, equipment, and documents to patient homes? Epyc Courier Service provides HIPAA-compliant delivery with real-time tracking and proof of delivery. We serve the entire Los Angeles metropolitan area including West LA, Encino, Glendale, Pasadena, and the South Bay. 818-217-0070 | rico@epyccs.com | www.epyccs.com",,https://www.epyccs.com/contact,"#HomeHealth #HomeHealthCare #MedicalDelivery #HIPAA #LosAngeles #LABusiness #PatientCare",pending,,,Home Health Vertical
23,linkedin,2026-02-28,12:00,"Question for LA business owners: How much time does your team spend coordinating deliveries each week? If the answer is more than zero, you are paying your most valuable people to do logistics work instead of revenue-generating work. Epyc Courier Service takes delivery coordination off your plate entirely. Scheduled pickups. Guaranteed windows. Real-time tracking. Monthly reporting. One phone call to handle it all: 818-217-0070.",,https://www.epyccs.com/contact,"#BusinessEfficiency #OperationsManagement #LosAngeles #B2BLogistics #CourierServices #TimeManagement #Productivity",pending,,,Efficiency Angle
24,instagram,2026-02-28,11:00,"STAT delivery. 1 hour or less. When it absolutely cannot wait. Medical specimens. Legal documents. Critical parts. Emergency prescriptions. Epyc Courier Service — STAT delivery across Los Angeles County. Call now: 818-217-0070",https://epyccs.com/images/on-demand.jpg,,"#STATDelivery #EmergencyDelivery #SameDayDelivery #LosAngeles #MedicalCourier #LegalCourier #CourierService #RushDelivery #LABusiness #UrgentDelivery",pending,,,STAT Service
25,linkedin,2026-03-03,08:30,"We are offering a complimentary 2-week trial for new healthcare clients. No commitment required. No contracts to sign upfront. Here is what the trial includes: → HIPAA-compliant pickup and delivery → Chain of custody documentation → Real-time GPS tracking → Temperature-controlled transport (if needed) → Dedicated healthcare account specialist → Post-trial performance report with on-time metrics. If you manage logistics for a laboratory, pharmacy, urgent care, or medical office in Los Angeles, this is a risk-free way to experience the Epyc difference. Reply to connect or call 818-217-0070.",,https://www.epyccs.com/contact,"#MedicalCourier #FreeTrialOffer #HIPAA #HealthcareLogistics #LosAngeles #LabLogistics #PharmacyDelivery #CourierService",pending,,,Trial Offer - Medical
26,instagram,2026-03-03,11:00,"Free 2-week trial for LA healthcare facilities. No commitment. No contract. Just results. HIPAA-compliant medical courier service with chain of custody, temperature control, and real-time tracking. See the difference for yourself. 818-217-0070 | rico@epyccs.com",https://epyccs.com/images/medical-courier.jpg,,"#FreeTrial #MedicalCourier #HIPAA #LosAngeles #HealthcareLogistics #LabLogistics #CourierService #LABusiness #SmallBusinessLA #SpecimenTransport",pending,,,Trial Offer Instagram
27,facebook,2026-03-03,13:00,"LA businesses: Are you still gambling with delivery services that treat your packages like an afterthought? Epyc Courier Service is locally owned, never subcontracts, and maintains a 98.7% on-time delivery rate. Medical. Legal. B2B. Same-day. We handle it all with precision. Try us risk-free: complimentary 2-week trial for new clients. 818-217-0070 | www.epyccs.com",,https://www.epyccs.com/contact,"#CourierService #LosAngeles #LABusiness #FreeTrial #SmallBusinessLA #SameDayDelivery #ReliableDelivery",pending,,,Trial Offer Facebook
28,linkedin,2026-03-05,08:30,"Infusion pharmacies and nuclear pharmacies require the highest tier of courier service in healthcare. Infusion medications: temperature-sensitive biologics that must arrive within strict windows. Nuclear pharmacy: radioactive materials for imaging that decay by the hour. Both demand couriers who understand time-critical, compliance-heavy delivery. Epyc Courier Service provides early morning nuclear pharmacy routes and temperature-monitored infusion medication delivery across Los Angeles County. This is specialized work. We treat it that way.",,https://www.epyccs.com/contact,"#InfusionPharmacy #NuclearPharmacy #MedicalCourier #HIPAA #SpecialtyPharmacy #LosAngeles #HealthcareLogistics",pending,,,Specialty Pharmacy Deep
29,instagram,2026-03-05,11:00,"Reliability is not a feature. It is the entire product. 98.7% on-time. Every delivery tracked. Every pickup confirmed. Every package accounted for. Epyc Courier Service. Precision Delivery. Every Time. 818-217-0070",https://epyccs.com/images/package-delivery.jpg,,"#ReliableDelivery #CourierService #LosAngeles #OnTime #Precision #LABusiness #SmallBusinessLA #B2BLogistics #DeliveryService #TrustMatters",pending,,,Reliability Brand
30,facebook,2026-03-05,13:00,"Dental labs in LA — we know your turnaround time matters. Same-day pickup and delivery of impressions, crowns, bridges, and prosthetics between your lab and dental offices across Los Angeles County. Careful handling. Proof of delivery. Dedicated routes for high-volume labs. Epyc Courier Service. 818-217-0070 | rico@epyccs.com",,https://www.epyccs.com/contact,"#DentalLab #DentalLogistics #LosAngeles #SameDayDelivery #CourierService #LABusiness",pending,,,Dental Lab Facebook
31,linkedin,2026-03-07,12:00,"Century City and Downtown LA law firms handle thousands of time-sensitive documents every month. Court filings. Discovery materials. Contract packages. Confidential client documents. One missed deadline can mean sanctions, malpractice exposure, or lost cases. Epyc Courier Service provides same-day legal document delivery with: → Signature verification → Real-time tracking → Proof of delivery → Confidential handling protocols → Coverage of all LA County courthouses. Your deadlines are our mission. 818-217-0070.",,https://www.epyccs.com/contact,"#LegalCourier #LawFirm #CenturyCity #DTLA #CourtFiling #SameDayDelivery #LosAngeles #LegalLogistics",pending,,,Legal Deep Dive
32,instagram,2026-03-07,11:00,"Court filing deadline in 3 hours? We have got you covered. Epyc Courier Service provides same-day legal document delivery across all LA County courthouses. Real-time tracking. Signature verification. Proof of delivery. Your deadlines. Our mission. 818-217-0070",https://epyccs.com/images/court-filing.jpg,,"#LegalCourier #CourtFiling #LawFirm #SameDayDelivery #LosAngeles #DTLA #CenturyCity #CourierService #LegalLogistics #Deadline",pending,,,Legal Instagram
33,linkedin,2026-03-10,08:30,"Home health agencies in Los Angeles manage complex logistics every day: medical supplies to patient homes, lab specimens back to facilities, equipment deliveries on tight schedules. With 800+ Medicare-certified home health agencies in LA County, the demand for reliable medical delivery to residential addresses is massive — and growing. Epyc Courier Service provides HIPAA-compliant home health delivery with real-time tracking, proof of delivery, and coverage across all LA neighborhoods. If your agency needs a courier partner who understands home health logistics, let us talk.",,https://www.epyccs.com/contact,"#HomeHealth #HomeHealthCare #MedicalDelivery #HIPAA #LosAngeles #HealthcareLogistics #CourierService #PatientCare",pending,,,Home Health LinkedIn
34,instagram,2026-03-10,11:00,"From our fleet to your facility. From your facility to your patients. Every step tracked. Every delivery documented. Epyc Courier Service — the logistics bridge between LA healthcare providers and the patients they serve. 818-217-0070 | www.epyccs.com",https://epyccs.com/images/medical-equipment.jpg,,"#HealthcareLogistics #MedicalCourier #PatientCare #LosAngeles #CourierService #HIPAA #HomeHealth #LABusiness #SmallBusinessLA #Delivery",pending,,,Healthcare Bridge
35,facebook,2026-03-10,13:00,"Mid-Wilshire. Koreatown. DTLA. Glendale. Van Nuys. Beverly Hills. Torrance. Pasadena. Long Beach. We cover every major medical corridor in Los Angeles County. If your lab, pharmacy, or medical office needs a reliable courier, Epyc is already in your neighborhood. 818-217-0070 | rico@epyccs.com | www.epyccs.com",,https://www.epyccs.com/contact,"#LosAngeles #MedicalCourier #LACounty #CourierService #HealthcareLogistics #LocalBusiness",pending,,,Geographic Coverage
36,linkedin,2026-03-12,08:30,"E-commerce businesses in Los Angeles have a same-day delivery advantage that most are not using. While your competitors rely on 3-5 day national shipping, you can offer LOCAL customers same-day delivery with photo proof, real-time tracking, and white-glove handling. Epyc Courier Service partners with LA-based e-commerce retailers, boutiques, and DTC brands to provide last-mile fulfillment that actually builds customer loyalty. Same-day and next-day options. Returns handling. Branded delivery experience. Turn delivery into a competitive advantage.",,https://www.epyccs.com/contact,"#EcommerceFulfillment #LastMileDelivery #LosAngeles #SameDayDelivery #DTC #RetailLogistics #SmallBusinessLA #CourierService",pending,,,E-Commerce Vertical
37,linkedin,2026-02-14,12:00,"We are hiring. Epyc Courier Service is looking for independent contractor drivers in the Los Angeles area to join our medical courier and same-day delivery team. This is not a gig app. We assign routes directly to you — no swiping, no algorithms, no competing with bots. Medical route drivers earn $45-$65 per delivery. STAT/rush deliveries pay $65-$85. We provide free HIPAA training and consistent daily work. If you are a professional driver who values reliability over randomness, we want to talk. Apply: epyccs.com/careers or call 818-217-0070",,https://www.epyccs.com/careers,"#NowHiring #CourierJobs #LosAngelesJobs #MedicalCourier #IndependentContractor #DriverJobs #LAJobs #GigWork #DeliveryDriver",pending,,,Driver Recruitment LinkedIn
38,instagram,2026-02-14,11:00,"NOW HIRING — Independent Courier Drivers in LA. Not a gig app. We assign routes directly to YOU. Medical routes: $45-$65/delivery. Rush: $65-$85. Scheduled routes: $150-$200/day. Free HIPAA training. Weekly pay. Consistent work. DM us, call 818-217-0070, or visit epyccs.com/careers",https://epyccs.com/images/commercial-delivery.jpg,https://www.epyccs.com/careers,"#NowHiring #LAJobs #CourierDriver #MedicalCourier #LosAngeles #HiringNow #DeliveryJobs #IndependentContractor #GigEconomy #DriverWanted",pending,,,Driver Recruitment Instagram
39,facebook,2026-02-14,13:00,"HIRING: Independent Courier Drivers — Los Angeles. Epyc Courier Service is looking for 3-5 reliable drivers. We specialize in medical delivery and same-day service. This is NOT a gig app — we assign routes directly to you. Pay: $25-$85 per delivery depending on service type. Medical routes pay premium. We provide free HIPAA training. Consistent daily work, weekly pay. If you are tired of fighting algorithms for $15 deliveries, this is different. Call Rico: 818-217-0070 | rico@epyccs.com | epyccs.com/careers",,https://www.epyccs.com/careers,"#NowHiring #LosAngeles #CourierJobs #DeliveryDriver #LAJobs #HiringDrivers",pending,,,Driver Recruitment Facebook
40,linkedin,2026-02-26,12:00,"The courier drivers who earn the most with Epyc are the ones who chose consistency over chaos. Our medical route drivers handle HIPAA-compliant deliveries for labs, pharmacies, and healthcare facilities — the same clients, the same routes, the same high-paying work every week. No algorithms deciding your fate. No surge pricing games. No wondering if you will make rent. We are still hiring experienced drivers in LA. Free HIPAA training provided. $800-$1,500/week for full-time drivers. Apply: epyccs.com/careers",,https://www.epyccs.com/careers,"#NowHiring #CourierJobs #LosAngeles #MedicalCourier #DriverJobs #LAJobs #IndependentContractor #HealthcareLogistics",pending,,,Driver Recruitment LinkedIn 2
41,instagram,2026-02-26,11:00,"Still hiring. Still not a gig app. Medical courier drivers in LA earning $800-$1,500/week with Epyc. Consistent routes. Weekly pay. Free HIPAA training. Your deliveries, your schedule, your income — without the algorithm. Link in bio or call 818-217-0070",https://epyccs.com/images/on-demand.jpg,https://www.epyccs.com/careers,"#NowHiring #LAJobs #CourierDriver #MedicalCourier #LosAngeles #HiringNow #DeliveryJobs #WeeklyPay #NoAlgorithm #DriverWanted",pending,,,Driver Recruitment Instagram 2
